{
  "inputs": [],
  "outputs": [
    "String"
  ],
  "defaults": {},
  "instances": {
    "02fe49fa-8d5e-47ac-abc0-8da936835af9": {
      "node_type": {
        "Atomic": {
          "Control": "Start"
        }
      },
      "default_overrides": {},
      "outputs": [],
      "control_flow_in": [],
      "control_flow_out": [
        [
          [
            "f26a2237-df7a-484a-b814-f2d8af7566fe",
            0
          ]
        ]
      ],
      "inputs": []
    },
    "9b87163b-8b13-49e2-a2d5-331dfe17c784": {
      "node_type": {
        "Atomic": {
          "Value": "gpt-4o"
        }
      },
      "default_overrides": {},
      "outputs": [
        "30911659-0dc5-4ee7-b586-b08a0909c089"
      ],
      "control_flow_in": [
        [
          [
            "f26a2237-df7a-484a-b814-f2d8af7566fe",
            0
          ]
        ]
      ],
      "control_flow_out": [
        []
      ],
      "inputs": []
    },
    "851dc390-255d-440d-b223-4d579aa22729": {
      "node_type": {
        "Atomic": {
          "Value": 0.7
        }
      },
      "default_overrides": {},
      "outputs": [
        "30911659-0dc5-4ee7-b586-b08a0909c089"
      ],
      "control_flow_in": [
        [
          [
            "f26a2237-df7a-484a-b814-f2d8af7566fe",
            0
          ]
        ]
      ],
      "control_flow_out": [
        [
          [
            "3d7dfcca-48c9-4022-903e-075448ac1e6a",
            0
          ]
        ]
      ],
      "inputs": []
    },
    "30911659-0dc5-4ee7-b586-b08a0909c089": {
      "node_type": {
        "Atomic": {
          "AgentOp": {
            "Create": "OpenAi"
          }
        }
      },
      "default_overrides": {},
      "outputs": [
        "0ac4b09a-498c-4d4e-88d9-b59bfcff2ae8",
        "80eb128a-c163-4773-80e3-ff5505173319"
      ],
      "control_flow_in": [
        [
          [
            "3d7dfcca-48c9-4022-903e-075448ac1e6a",
            0
          ]
        ]
      ],
      "control_flow_out": [
        [
          [
            "0ac4b09a-498c-4d4e-88d9-b59bfcff2ae8",
            0
          ]
        ]
      ],
      "inputs": [
        [
          "String",
          "9b87163b-8b13-49e2-a2d5-331dfe17c784",
          0
        ],
        [
          "None",
          "3d7dfcca-48c9-4022-903e-075448ac1e6a",
          0
        ],
        [
          "Float",
          "851dc390-255d-440d-b223-4d579aa22729",
          0
        ]
      ]
    },
    "0ac4b09a-498c-4d4e-88d9-b59bfcff2ae8": {
      "node_type": {
        "Atomic": {
          "AgentOp": "Send"
        }
      },
      "default_overrides": {},
      "outputs": [],
      "control_flow_in": [
        [
          [
            "30911659-0dc5-4ee7-b586-b08a0909c089",
            0
          ]
        ]
      ],
      "control_flow_out": [
        [
          [
            "80eb128a-c163-4773-80e3-ff5505173319",
            0
          ]
        ]
      ],
      "inputs": [
        [
          {
            "Agent": "OpenAi"
          },
          "30911659-0dc5-4ee7-b586-b08a0909c089",
          0
        ],
        [
          "String",
          "f26a2237-df7a-484a-b814-f2d8af7566fe",
          0
        ]
      ]
    },
    "80eb128a-c163-4773-80e3-ff5505173319": {
      "node_type": {
        "Atomic": {
          "AgentOp": "Recieve"
        }
      },
      "default_overrides": {},
      "outputs": [
        "b2be1b1d-937e-4dc7-bdc6-d91089666772",
        "fb2389ec-ca17-4b32-90ca-3a7725096da1"
      ],
      "control_flow_in": [
        [
          [
            "0ac4b09a-498c-4d4e-88d9-b59bfcff2ae8",
            0
          ]
        ]
      ],
      "control_flow_out": [
        [
          [
            "b2be1b1d-937e-4dc7-bdc6-d91089666772",
            0
          ]
        ]
      ],
      "inputs": [
        [
          {
            "Agent": "OpenAi"
          },
          "30911659-0dc5-4ee7-b586-b08a0909c089",
          0
        ]
      ]
    },
    "b2be1b1d-937e-4dc7-bdc6-d91089666772": {
      "node_type": {
        "Atomic": "Print"
      },
      "default_overrides": {},
      "outputs": [],
      "control_flow_in": [
        [
          [
            "80eb128a-c163-4773-80e3-ff5505173319",
            0
          ]
        ]
      ],
      "control_flow_out": [
        [
          [
            "fb2389ec-ca17-4b32-90ca-3a7725096da1",
            0
          ]
        ]
      ],
      "inputs": [
        [
          "String",
          "80eb128a-c163-4773-80e3-ff5505173319",
          0
        ]
      ]
    },
    "fb2389ec-ca17-4b32-90ca-3a7725096da1": {
      "node_type": {
        "Atomic": {
          "Control": "End"
        }
      },
      "default_overrides": {},
      "outputs": [
        "f14937c5-ec15-431a-96dc-38dd1a550d1e"
      ],
      "control_flow_in": [
        [
          [
            "b2be1b1d-937e-4dc7-bdc6-d91089666772",
            0
          ]
        ]
      ],
      "control_flow_out": [],
      "inputs": [
        [
          "String",
          "80eb128a-c163-4773-80e3-ff5505173319",
          0
        ]
      ]
    },
    "3d7dfcca-48c9-4022-903e-075448ac1e6a": {
      "node_type": {
        "Atomic": {
          "Value": null
        }
      },
      "default_overrides": {},
      "outputs": [
        "30911659-0dc5-4ee7-b586-b08a0909c089"
      ],
      "control_flow_in": [
        [
          [
            "851dc390-255d-440d-b223-4d579aa22729",
            0
          ]
        ]
      ],
      "control_flow_out": [
        [
          [
            "30911659-0dc5-4ee7-b586-b08a0909c089",
            0
          ]
        ]
      ],
      "inputs": []
    },
    "f26a2237-df7a-484a-b814-f2d8af7566fe": {
      "node_type": {
        "Atomic": {
          "Value": "Hello"
        }
      },
      "default_overrides": {},
      "outputs": [
        "0ac4b09a-498c-4d4e-88d9-b59bfcff2ae8"
      ],
      "control_flow_in": [
        [
          [
            "02fe49fa-8d5e-47ac-abc0-8da936835af9",
            0
          ]
        ]
      ],
      "control_flow_out": [
        [
          [
            "9b87163b-8b13-49e2-a2d5-331dfe17c784",
            0
          ],
          [
            "851dc390-255d-440d-b223-4d579aa22729",
            0
          ]
        ]
      ],
      "inputs": []
    }
  },
  "end_node": "fb2389ec-ca17-4b32-90ca-3a7725096da1"
}