{
  "defaults": {},
  "inputs": [],
  "end_node": "0bee5a7c-2d5f-11f1-834f-00155d65b92e",
  "outputs": [],
  "instances": {
    "eb5a58f4-2d56-11f1-aed2-00155d65b92e":{
      "control_flow_in": [],
      "control_flow_out": [[["e5d0cc8c-2d57-11f1-a4b9-00155d65b92e", 0]]],
      "inputs": [],
      "outputs": [],
      "default_overrides": {},
      "node_type":{
        "Atomic":{
          "Control":"Start"
        }
      }
    },
    "e5d0cc8c-2d57-11f1-a4b9-00155d65b92e":{
      "control_flow_in": [[["eb5a58f4-2d56-11f1-aed2-00155d65b92e",0]]],
      "control_flow_out": [[["19b1d0d6-2d59-11f1-b95f-00155d65b92e", 0]]],
      "inputs": [],
      "outputs": ["19b1d0d6-2d59-11f1-b95f-00155d65b92e"],
      "default_overrides": {},
      "node_type":
      {
        "Atomic":{
          "Value":0
        }
      }
    },
    "19b1d0d6-2d59-11f1-b95f-00155d65b92e":{
      "control_flow_in": [[["e5d0cc8c-2d57-11f1-a4b9-00155d65b92e", 0]]],
      "control_flow_out": [[["15368b12-2d5b-11f1-a413-00155d65b92e", 0]]],
      "inputs": [["Integer", "e5d0cc8c-2d57-11f1-a4b9-00155d65b92e", 0]],
      "outputs": [],
      "default_overrides": {},
      "node_type":{
        "Atomic":{"Variable": ["Set", "Counter"]}
      }
    },
    "15368b12-2d5b-11f1-a413-00155d65b92e":{
      "control_flow_in": [[["19b1d0d6-2d59-11f1-b95f-00155d65b92e", 0]]],
      "control_flow_out": [[["46925fd2-2d5c-11f1-b293-00155d65b92e", 0]]],
      "inputs": [],
      "outputs": [],
      "default_overrides": {},
      "node_type":{
        "Atomic":{
          "Control":{"Loop":"Start"}
        }
      }
    },
    "46925fd2-2d5c-11f1-b293-00155d65b92e":{
      "control_flow_in": [[["15368b12-2d5b-11f1-a413-00155d65b92e", 0]]],
      "control_flow_out": [[["dd8cdf52-2d5c-11f1-8047-00155d65b92e", 0], ["75f24fc8-2d5f-11f1-b159-00155d65b92e", 0]]],
      "inputs": [],
      "outputs": ["dd8cdf52-2d5c-11f1-8047-00155d65b92e", "8d281f26-2d5d-11f1-b546-00155d65b92e", "e7671922-2d5f-11f1-b4bb-00155d65b92e"],
      "default_overrides": {},
      "node_type":{
        "Atomic":{"Variable": ["Get", "Counter"]}
      }
    },
    "dd8cdf52-2d5c-11f1-8047-00155d65b92e":{
      "control_flow_in": [[["46925fd2-2d5c-11f1-b293-00155d65b92e", 0]]],
      "control_flow_out": [[["0bbfe3ce-2d5d-11f1-b89b-00155d65b92e", 0]]],
      "inputs": [["Integer", "46925fd2-2d5c-11f1-b293-00155d65b92e", 0]],
      "outputs": [],
      "default_overrides": {},
      "node_type":{
        "Atomic":"Print"
      }
    },
    "0bbfe3ce-2d5d-11f1-b89b-00155d65b92e":{
      "control_flow_in": [[["dd8cdf52-2d5c-11f1-8047-00155d65b92e", 0]]],
      "control_flow_out": [[["8d281f26-2d5d-11f1-b546-00155d65b92e", 0]]],
      "inputs": [],
      "outputs": ["8d281f26-2d5d-11f1-b546-00155d65b92e"],
      "default_overrides": {},
      "node_type":{
        "Atomic":{"Value":10}
      }
    },
    "8d281f26-2d5d-11f1-b546-00155d65b92e":{
      "control_flow_in": [[["0bbfe3ce-2d5d-11f1-b89b-00155d65b92e", 0]]],
      "control_flow_out": [[["035677a6-2d5e-11f1-a539-00155d65b92e", 0]]],
      "inputs": [
        ["Integer", "0bbfe3ce-2d5d-11f1-b89b-00155d65b92e", 0], 
        ["Integer", "46925fd2-2d5c-11f1-b293-00155d65b92e", 0]
      ],
      "outputs": ["035677a6-2d5e-11f1-a539-00155d65b92e"],
      "default_overrides": {},
      "node_type":{
        "Atomic":{"LogicalOp": "Eq"}
      }
    },
    "035677a6-2d5e-11f1-a539-00155d65b92e":
    {
      "control_flow_in": [[["8d281f26-2d5d-11f1-b546-00155d65b92e", 0]]],
      "control_flow_out": [[["85194b56-2d5e-11f1-bfb4-00155d65b92e", 0]], [["0bee5a7c-2d5f-11f1-834f-00155d65b92e", 1]]],
      "inputs": [["Boolean", "8d281f26-2d5d-11f1-b546-00155d65b92e", 0]],
      "outputs": [],
      "default_overrides": {},
      "node_type":{
        "Atomic":{"Control":"If"}
      }
    },
    "85194b56-2d5e-11f1-bfb4-00155d65b92e":{
      "control_flow_in": [[["035677a6-2d5e-11f1-a539-00155d65b92e", 0]]],
      "control_flow_out": [],
      "inputs": [],
      "outputs": [],
      "default_overrides": {},
      "node_type":{
        "Atomic":{
          "Control":
          {
            "Loop":
            {
              "Continue": "15368b12-2d5b-11f1-a413-00155d65b92e"
            }
          }
        }
      }
    },
    "0bee5a7c-2d5f-11f1-834f-00155d65b92e":{
      "control_flow_in": [[["035677a6-2d5e-11f1-a539-00155d65b92e", 1]]],
      "control_flow_out": [],
      "inputs": [],
      "outputs": [],
      "default_overrides": {},
      "node_type":{
        "Atomic":{
          "Control":"End"
        }
      }
    },
    "75f24fc8-2d5f-11f1-b159-00155d65b92e":{
      "control_flow_in": [[["46925fd2-2d5c-11f1-b293-00155d65b92e", 0]]],
      "control_flow_out": [],
      "inputs": [],
      "outputs": ["e7671922-2d5f-11f1-b4bb-00155d65b92e"],
      "default_overrides": {},
      "node_type":{
        "Atomic":{"Value":1}
      }
    },
    "e7671922-2d5f-11f1-b4bb-00155d65b92e":{
      "control_flow_in": [[["75f24fc8-2d5f-11f1-b159-00155d65b92e", 0]]],
      "control_flow_out": [],
      "inputs": [["Integer", "46925fd2-2d5c-11f1-b293-00155d65b92e", 0], ["Integer", "75f24fc8-2d5f-11f1-b159-00155d65b92e", 0]],
      "outputs": [],
      "default_overrides": {},
      "node_type":{
        "Atomic":{"BinOp": "Add"}
      }
    },
    "4a2a0330-2d60-11f1-98c6-00155d65b92e":
    {
      "control_flow_in": [[["e7671922-2d5f-11f1-b4bb-00155d65b92e", 0]]],
      "control_flow_out": [],
      "inputs": [["Integer", "e7671922-2d5f-11f1-b4bb-00155d65b92e", 0]],
      "outputs": [],
      "default_overrides": {},
      "node_type":{
        "Atomic":{
          "Variable": ["Set", "Counter"]
        }
      }
    }
  }
}